<?xml version="1.0" encoding="UTF-8"?>
<!DOCTYPE mozi SYSTEM "mozi.dtd">
<mozi>
    <film id="txn_nxm_2jb" mufaj="horror">
        <rendezo id="nzk">
            <nev>Riley Scott</nev>
            <telefonszam>+3641323123</telefonszam>
        </rendezo>
        <szinesz id="négy" nev="Martin"></szinesz>
        <szinesz id="q">
            <gyerekszinesz/>
            <musicalszinesz/>
            <szinkronszinesz/>
        </szinesz>
        <iro>
            <nev>J. R. R. Tolkien</nev>
            <datum>29 July 1954</datum>
        </iro>
    </film>
</mozi>